{"recordVersion":"0.9","cpu":{"vendor":"OldVendor","family":15,"model":5,"stepping":9,"key":"GenuineIntel-6-C6-2","directory":"arch/x86/oldlake/"},"machine":{"packages":9,"l3Groups":9,"cores":99,"threads":99,"mask":"0-1","l3":[{"ordinal":9,"cpus":"9"}],"nodes":null},"evidence":[{"path":"specs/035-numa-placement/results/nps1.md","command":"ctest --test-dir build -R harness_numa_placement_test","exit":0,"line":"$ ctest --test-dir build -R harness_numa_placement_test"},{"path":"specs/034-host-noise-precheck/results/quickstart.md","command":"ctest --test-dir build -R harness_precheck","exit":0,"line":"| Feature suite | `ctest --test-dir build -R harness_precheck` | 0 | 1 test, ok |"},{"path":"specs/035-numa-placement/results/quickstart.md","command":"ctest --test-dir build -R harness_json","exit":0,"line":"| The round trip holds | `ctest --test-dir build -R harness_json` | 0 | the written and reloaded documents compare equal |"}]}