{"recordVersion":"1.0","cpu":{"vendor":"GenuineIntel","family":6,"model":198,"stepping":2,"key":"GenuineIntel-6-C6-2","directory":"arch/x86/arrowlake/"},"machine":{"packages":2,"l3Groups":2,"cores":4,"threads":6,"mask":"0-2,12-13,24","l3":[{"ordinal":0,"cpus":"0-2"},{"ordinal":1,"cpus":"12-13,24"}],"nodes":[{"number":0,"cpus":"0-2,12-13"},{"number":1,"cpus":"24"}]},"evidence":[]}