{"recordVersion":"1.0","cpu":{"vendor":"GenuineIntel","family":6,"model":198,"stepping":2,"key":"GenuineIntel-6-C6-2","directory":"arch/x86/arrowlake/"},"machine":{"packages":1,"l3Groups":1,"cores":20,"threads":20,"mask":"0-19","l3":[{"ordinal":0,"cpus":"0-19"}],"nodes":[{"number":0,"cpus":"0-19"}]},"evidence":[]}