{"recordVersion":"1.0","cpu":{"vendor":"GenuineIntel","family":6,"model":198,"stepping":2,"key":"GenuineIntel-6-C6-2","directory":"arch/x86/arrowlake/"},"machine":{"packages":1,"l3Groups":2,"cores":20,"threads":20,"mask":"0-19","l3":[{"ordinal":0,"cpus":"0-7"},{"ordinal":1,"cpus":"8-19"}],"nodes":[{"number":0,"cpus":"0-19"}]},"evidence":[{"path":"specs/035-numa-placement/results/nps1.md","command":"ctest --test-dir build -R harness_numa_placement_test","exit":0,"line":"$ ctest --test-dir build -R harness_numa_placement_test"}]}