{"recordVersion":"1.0","cpu":{"vendor":"GenuineIntel","family":6,"model":198,"stepping":2,"key":"GenuineIntel-6-C6-2","directory":"arch/x86/arrowlake/"},"machine":{"packages":2,"l3Groups":2,"cores":4,"threads":6,"mask":"0-2,12-13,24","l3":[{"ordinal":0,"cpus":"0-2"},{"ordinal":1,"cpus":"12-13,24"}],"nodes":[{"number":0,"cpus":"0-2,12-13"},{"number":1,"cpus":"24"}]},"evidence":[{"path":"specs/035-numa-placement/results/nps1.md","command":"ctest --test-dir build -R harness_numa_placement_test","exit":0,"line":"$ ctest --test-dir build -R harness_numa_placement_test"},{"path":"specs/034-host-noise-precheck/results/quickstart.md","command":"ctest --test-dir build -R harness_precheck","exit":0,"line":"| Feature suite | `ctest --test-dir build -R harness_precheck` | 0 | 1 test, ok |"},{"path":"specs/035-numa-placement/results/quickstart.md","command":"ctest --test-dir build -R harness_json","exit":0,"line":"| The round trip holds | `ctest --test-dir build -R harness_json` | 0 | the written and reloaded documents compare equal |"}]}